{
  "schema_version": "1.1",
  "job_id": "ops-full-article",
  "phase": "validating",
  "source": {
    "kind": "local",
    "input_video_path": "/tmp/video.mp4",
    "source_sha256": "abc123",
    "origin_path": "/tmp/video.mp4",
    "origin_url": null,
    "resolved_url": null,
    "platform": null,
    "download_status": "skipped",
    "downloaded_video_path": null,
    "downloader": null,
    "duration_sec": null,
    "size_bytes": null
  },
  "template": {
    "suggested": "podcast_interview",
    "confirmed": null,
    "confidence": 1.0
  },
  "preferences": {
    "length_mode": "topic_complete",
    "target_seconds": null,
    "transcription_mode": "whisper",
    "diarization_mode": "auto",
    "language_hint": "auto"
  },
  "artifacts": {
    "probe": null,
    "capability": null,
    "execution_profile": null,
    "estimate": null,
    "progress_log": "logs/progress.json",
    "download_metadata": null,
    "audio": null,
    "transcript_segments": null,
    "transcript_text": "transcript/transcript.txt",
    "transcript_srt": null,
    "transcript_vtt": null,
    "utterances": "transcript/utterances.json",
    "diarization": null,
    "template_decision": null,
    "segment_candidates": null,
    "clip_plan": null,
    "publish_manifest": "ops/publish_manifest.json",
    "full_article_markdown": "ops/full_article.md",
    "full_article_docx": "ops/full_article.docx",
    "full_article_pdf": "ops/full_article.pdf",
    "validation_report": null
  },
  "confirmations": {
    "template_gate": {
      "required": true,
      "confirmed": false,
      "confirmed_at": null
    },
    "plan_gate": {
      "required": true,
      "confirmed": false,
      "confirmed_at": null
    }
  },
  "preflight": {
    "verdict": "pending",
    "checked_at": null,
    "warnings": [],
    "blocking_reasons": []
  },
  "execution_profile": null,
  "progress": {
    "started_at": "2026-07-11T05:15:52+00:00",
    "updated_at": "2026-07-11T05:15:52+00:00",
    "overall_percent": 96,
    "eta_seconds_remaining": null,
    "current_step": {
      "id": "ops",
      "label": "Publish package generation",
      "state": "completed",
      "eta_seconds": 0,
      "message": "Publish package generation completed"
    },
    "steps": [
      {
        "id": "probe",
        "label": "Machine check",
        "state": "pending"
      },
      {
        "id": "transcribe",
        "label": "Transcription",
        "state": "pending"
      },
      {
        "id": "plan",
        "label": "Clip planning",
        "state": "pending"
      },
      {
        "id": "render",
        "label": "Clip rendering",
        "state": "pending"
      },
      {
        "id": "ops",
        "label": "Publish package generation",
        "state": "completed"
      },
      {
        "id": "validate",
        "label": "Output validation",
        "state": "pending"
      }
    ]
  },
  "history": [
    {
      "phase": "created",
      "at": "2026-07-11T05:15:52+00:00",
      "note": "job created"
    },
    {
      "phase": "probed",
      "at": "2026-07-11T05:15:52+00:00",
      "note": "transitioned from created"
    },
    {
      "phase": "awaiting_template_confirmation",
      "at": "2026-07-11T05:15:52+00:00",
      "note": "transitioned from probed"
    },
    {
      "phase": "confirmed_for_transcription",
      "at": "2026-07-11T05:15:52+00:00",
      "note": "transitioned from awaiting_template_confirmation"
    },
    {
      "phase": "transcribing",
      "at": "2026-07-11T05:15:52+00:00",
      "note": "transitioned from confirmed_for_transcription"
    },
    {
      "phase": "transcribed",
      "at": "2026-07-11T05:15:52+00:00",
      "note": "transitioned from transcribing"
    },
    {
      "phase": "analysis_ready",
      "at": "2026-07-11T05:15:52+00:00",
      "note": "transitioned from transcribed"
    },
    {
      "phase": "awaiting_plan_confirmation",
      "at": "2026-07-11T05:15:52+00:00",
      "note": "transitioned from analysis_ready"
    },
    {
      "phase": "approved_for_render",
      "at": "2026-07-11T05:15:52+00:00",
      "note": "transitioned from awaiting_plan_confirmation"
    },
    {
      "phase": "rendering",
      "at": "2026-07-11T05:15:52+00:00",
      "note": "transitioned from approved_for_render"
    },
    {
      "phase": "ops_generating",
      "at": "2026-07-11T05:15:52+00:00",
      "note": "transitioned from rendering"
    },
    {
      "phase": "validating",
      "at": "2026-07-11T05:15:52+00:00",
      "note": "ops package generated, validating outputs next"
    }
  ],
  "errors": []
}
