{
  "schema_version": "1.1",
  "job_id": "https-youtu-be-example__d26a0caa",
  "phase": "created",
  "source": {
    "kind": "url",
    "input_video_path": null,
    "source_sha256": null,
    "origin_path": null,
    "origin_url": "https://youtu.be/example",
    "resolved_url": null,
    "platform": "youtube",
    "download_status": "pending",
    "downloaded_video_path": null,
    "downloader": null,
    "duration_sec": null,
    "size_bytes": null
  },
  "template": {
    "suggested": "podcast_interview",
    "confirmed": null,
    "confidence": 1.0
  },
  "preferences": {
    "length_mode": "topic_complete",
    "target_seconds": null,
    "transcription_mode": "whisper",
    "diarization_mode": "auto",
    "language_hint": "auto"
  },
  "artifacts": {
    "probe": null,
    "capability": null,
    "execution_profile": null,
    "estimate": null,
    "progress_log": null,
    "download_metadata": null,
    "audio": null,
    "transcript_segments": null,
    "transcript_text": null,
    "transcript_srt": null,
    "transcript_vtt": null,
    "utterances": null,
    "diarization": null,
    "template_decision": null,
    "segment_candidates": null,
    "clip_plan": null,
    "publish_manifest": null
  },
  "confirmations": {
    "template_gate": {
      "required": true,
      "confirmed": false,
      "confirmed_at": null
    },
    "plan_gate": {
      "required": true,
      "confirmed": false,
      "confirmed_at": null
    }
  },
  "preflight": {
    "verdict": "pending",
    "checked_at": null,
    "warnings": [],
    "blocking_reasons": []
  },
  "execution_profile": null,
  "progress": {
    "started_at": null,
    "updated_at": "2026-06-02T08:34:56+00:00",
    "overall_percent": 0,
    "eta_seconds_remaining": null,
    "current_step": {
      "id": null,
      "label": null,
      "state": "pending",
      "eta_seconds": null,
      "message": "Job created"
    },
    "steps": [
      {
        "id": "probe",
        "label": "Machine check",
        "state": "pending"
      },
      {
        "id": "transcribe",
        "label": "Transcription",
        "state": "pending"
      },
      {
        "id": "plan",
        "label": "Clip planning",
        "state": "pending"
      },
      {
        "id": "render",
        "label": "Clip rendering",
        "state": "pending"
      },
      {
        "id": "ops",
        "label": "Publish package generation",
        "state": "pending"
      }
    ]
  },
  "history": [
    {
      "phase": "created",
      "at": "2026-06-02T08:34:56+00:00",
      "note": "job created"
    }
  ],
  "errors": []
}
