{
  "schema_version": "1.1",
  "job_id": "url-download-reuse",
  "phase": "awaiting_template_confirmation",
  "source": {
    "kind": "url",
    "input_video_path": "/var/folders/9c/k3xx94114vqbb24l8npj5mkr0000gn/T/tmptly3l6gz.mp4",
    "source_sha256": "3e66ede228ae2f3f6cf3c95cb1fba47226b630fa25b4da48f3438fcb7c9d6376",
    "origin_path": null,
    "origin_url": "https://youtu.be/example",
    "resolved_url": "https://youtu.be/example",
    "platform": "youtube",
    "download_status": "completed",
    "downloaded_video_path": "/var/folders/9c/k3xx94114vqbb24l8npj5mkr0000gn/T/tmptly3l6gz.mp4",
    "downloader": "yt-dlp",
    "duration_sec": 12.5,
    "size_bytes": 1234
  },
  "template": {
    "suggested": "podcast_interview",
    "confirmed": null,
    "confidence": 1.0
  },
  "preferences": {
    "length_mode": "topic_complete",
    "target_seconds": null,
    "transcription_mode": "whisper",
    "diarization_mode": "auto",
    "language_hint": "auto"
  },
  "artifacts": {
    "probe": "probe/probe.json",
    "capability": "probe/capability.json",
    "execution_profile": "probe/execution_profile.json",
    "estimate": "probe/estimate.json",
    "progress_log": "logs/progress.json",
    "download_metadata": null,
    "audio": null,
    "transcript_segments": null,
    "transcript_text": null,
    "transcript_srt": null,
    "transcript_vtt": null,
    "utterances": null,
    "diarization": null,
    "template_decision": null,
    "segment_candidates": null,
    "clip_plan": null,
    "publish_manifest": null,
    "full_article_markdown": null,
    "full_article_docx": null,
    "full_article_pdf": null,
    "validation_report": null
  },
  "confirmations": {
    "template_gate": {
      "required": true,
      "confirmed": false,
      "confirmed_at": null
    },
    "plan_gate": {
      "required": true,
      "confirmed": false,
      "confirmed_at": null
    }
  },
  "preflight": {
    "verdict": "ok",
    "checked_at": "2026-06-14T09:12:15+00:00",
    "warnings": [],
    "blocking_reasons": []
  },
  "execution_profile": {
    "verdict": "ok",
    "asr_backend": "faster-whisper",
    "asr_model": "small",
    "device": "cpu",
    "compute_type": "int8",
    "language_hint": "auto",
    "diarization_enabled": false,
    "diarization_reason": "disabled",
    "warnings": [],
    "blocking_reasons": [],
    "resource_summary": {
      "cpu_count": 4,
      "memory_total_bytes": 8,
      "memory_available_bytes": 8,
      "disk_free_bytes": 8
    }
  },
  "progress": {
    "started_at": "2026-06-14T09:12:15+00:00",
    "updated_at": "2026-06-14T09:12:15+00:00",
    "overall_percent": 20,
    "eta_seconds_remaining": null,
    "current_step": {
      "id": "probe",
      "label": "Machine check",
      "state": "completed",
      "eta_seconds": 0,
      "message": "Machine check completed"
    },
    "steps": [
      {
        "id": "probe",
        "label": "Machine check",
        "state": "completed"
      },
      {
        "id": "transcribe",
        "label": "Transcription",
        "state": "pending"
      },
      {
        "id": "plan",
        "label": "Clip planning",
        "state": "pending"
      },
      {
        "id": "render",
        "label": "Clip rendering",
        "state": "pending"
      },
      {
        "id": "ops",
        "label": "Publish package generation",
        "state": "pending"
      },
      {
        "id": "validate",
        "label": "Output validation",
        "state": "pending"
      }
    ]
  },
  "history": [
    {
      "phase": "created",
      "at": "2026-06-14T09:12:15+00:00",
      "note": "job created"
    },
    {
      "phase": "probed",
      "at": "2026-06-14T09:12:15+00:00",
      "note": "video metadata collected"
    },
    {
      "phase": "awaiting_template_confirmation",
      "at": "2026-06-14T09:12:15+00:00",
      "note": "waiting for user confirmation"
    }
  ],
  "errors": []
}
